{
  "schemaVersion": "1.0.0",
  "packetId": "packet:107:3-4",
  "sourcePackageId": "surah:107",
  "sourceFingerprint": "959701c8f10b1d49d588b33d9f6a1ebf266f570b3f12b493919aa7d6d7e5a0db",
  "knowledgeSnapshot": {
    "snapshotId": "ffabdaa3cda73da9c03837131ceabaec2ba348914404725cb0d4b7eebd74fcff",
    "version": "1.0.0",
    "files": [
      {
        "path": "content-authoring/production-knowledge/knowledge-version.json",
        "checksum": "31aedfc7a9316f665ca3b37bdfe8fd80010047315033b5e4fca0f4561fd9e681"
      },
      {
        "path": "content-authoring/production-knowledge/learner-context/form-families.json",
        "checksum": "2ba13ff2e862b39cf955c459e1d15dbde29a1e05f548b7f0a2a817cd35907294"
      },
      {
        "path": "content-authoring/production-knowledge/learner-context/grammar-concepts.json",
        "checksum": "7a950597fde0abb1cdcfc1f2f8cb8e1a2e9124aa584c823865f74c25258dabc2"
      },
      {
        "path": "content-authoring/production-knowledge/learner-context/particles.json",
        "checksum": "44b87ade17fc3e43d15ff22384f509ca74a0fa2ec36212bb0c6fb27e5c81b818"
      },
      {
        "path": "content-authoring/production-knowledge/learner-context/terminology.json",
        "checksum": "b0cabd6b4ad77f3c569572eca1982d289d6a40afc6b26078edb4e34cda42b0c4"
      },
      {
        "path": "content-authoring/production-knowledge/lexical-registry/occurrence-exceptions.json",
        "checksum": "68cc21608704da4e28ff5a6a1ad76b4104868b91d711c1212be4af48aa9684f9"
      },
      {
        "path": "content-authoring/production-knowledge/lexical-registry/shared-lessons.json",
        "checksum": "68cc21608704da4e28ff5a6a1ad76b4104868b91d711c1212be4af48aa9684f9"
      },
      {
        "path": "content-authoring/production-knowledge/safeguards/common-problems.json",
        "checksum": "ba934a2cfaf24171b31167f05d1527cbc276bb459cd050cf0a01c89c12a8cb9a"
      },
      {
        "path": "content-authoring/production-knowledge/safeguards/reviewer-rules.json",
        "checksum": "cb1dd530f2da3dec8165d65cca48b5b72e00c1b2aef28cab467c82bdf5c9149f"
      },
      {
        "path": "content-authoring/production-knowledge/safeguards/source-policy.json",
        "checksum": "be859c8cca897ed1d186816bdd591460ab20922084550466de34132647770dda"
      },
      {
        "path": "content-import/sources/qac/morphology-overrides.json",
        "checksum": "c70b8010c2b5f7df042967c0374af3b4c4b7f4c179f133c4e61ab021c1481f64"
      }
    ]
  },
  "status": "source-imported",
  "surahNumber": 107,
  "ayahStart": 3,
  "ayahEnd": 4,
  "sourceVersion": "tanzil-1.1",
  "sourceReferences": [
    {
      "provider": "tanzil",
      "recordKey": "surah:107",
      "version": "1.1",
      "attribution": "Tanzil Project"
    }
  ],
  "ayahs": [
    {
      "id": "ayah:107:3",
      "number": 3,
      "arabic": "وَلَا يَحُضُّ عَلَىٰ طَعَامِ ٱلْمِسْكِينِ",
      "sourceRawArabic": "وَلَا يَحُضُّ عَلَىٰ طَعَامِ ٱلْمِسْكِينِ",
      "words": [
        {
          "id": "word:107:3:1",
          "position": 1,
          "arabic": "وَلَا",
          "sourceReferences": [
            {
              "provider": "tanzil",
              "recordKey": "107:3",
              "version": "1.1",
              "attribution": "Tanzil Project"
            }
          ]
        },
        {
          "id": "word:107:3:2",
          "position": 2,
          "arabic": "يَحُضُّ",
          "sourceReferences": [
            {
              "provider": "tanzil",
              "recordKey": "107:3",
              "version": "1.1",
              "attribution": "Tanzil Project"
            }
          ]
        },
        {
          "id": "word:107:3:3",
          "position": 3,
          "arabic": "عَلَىٰ",
          "sourceReferences": [
            {
              "provider": "tanzil",
              "recordKey": "107:3",
              "version": "1.1",
              "attribution": "Tanzil Project"
            }
          ]
        },
        {
          "id": "word:107:3:4",
          "position": 4,
          "arabic": "طَعَامِ",
          "sourceReferences": [
            {
              "provider": "tanzil",
              "recordKey": "107:3",
              "version": "1.1",
              "attribution": "Tanzil Project"
            }
          ]
        },
        {
          "id": "word:107:3:5",
          "position": 5,
          "arabic": "ٱلْمِسْكِينِ",
          "sourceReferences": [
            {
              "provider": "tanzil",
              "recordKey": "107:3",
              "version": "1.1",
              "attribution": "Tanzil Project"
            }
          ]
        }
      ]
    },
    {
      "id": "ayah:107:4",
      "number": 4,
      "arabic": "فَوَيْلٌ لِّلْمُصَلِّينَ",
      "sourceRawArabic": "فَوَيْلٌ لِّلْمُصَلِّينَ",
      "words": [
        {
          "id": "word:107:4:1",
          "position": 1,
          "arabic": "فَوَيْلٌ",
          "sourceReferences": [
            {
              "provider": "tanzil",
              "recordKey": "107:4",
              "version": "1.1",
              "attribution": "Tanzil Project"
            }
          ]
        },
        {
          "id": "word:107:4:2",
          "position": 2,
          "arabic": "لِّلْمُصَلِّينَ",
          "sourceReferences": [
            {
              "provider": "tanzil",
              "recordKey": "107:4",
              "version": "1.1",
              "attribution": "Tanzil Project"
            }
          ]
        }
      ]
    }
  ]
}
